stt,question,answer
66,"Trong tiêu chuẩn thiết kế yếu tố hình học của đường quy định trong trường hợp
nào phải bố trí đường cong chuyển tiếp.
a. Khi vận tốc thiết kế Vtk ≥ 30 km/h
b. Khi vận tốc thiết kế Vtk ≥ 40 km/h
c. Khi vận tốc thiết kế Vtk ≥ 60 km/h
d.Khi vận tốc thiết kế Vtk ≥ 80 km/h",c 
67,"Trong thiết kế đường việc phối hợp giữa các yếu tố tuyến nhằm mục đích gì
a. Tạo tầm nhìn tốt, cung cấp thông tin cho người lái xe để kịp thời xử trí các
tình huống.
b. Tạo tâm lý thoải mái cho người lái, ít mệt nhọc, năng suất cao.
c. Tạo cho công trình phù hợp với cảnh quan, góp phần nâng cao vẻ đẹp khu
vực đặt tuyến.
d. Để đạt tất cả mục đích nêu trên",d 
68,"Trong tiêu chuẩn thiết kế đường quy định độ đốc dọc lớn nhất tùy thuộc vào
cấp hạng đường và điều kiện địa hình. Trường hợp đường cấp I đồng bằng thì
độ dốc dọc lớn nhất là bao nhiêu?
a. Độ dốc dọc lớn nhất 3%
b. Độ dốc dọc lớn nhất 4%
c. Độ dốc dọc lớn nhất 5%
d. Độ dốc dọc lớn nhất 6%",a 
69,"Trong tiêu chuẩn thiết kế đường quy định độ đốc dọc lớn nhất tùy thuộc vào
cấp hạng đường và điều kiện địa hình. Trường hợp đường cấp III, miền núi thì
độ dốc dọc lớn nhất là bao nhiêu?
a. Độ dốc dọc lớn nhất 4%
b. Độ dốc dọc lớn nhất 5%
c. Độ dốc dọc lớn nhất 6%
d. Độ dốc dọc lớn nhất 7%",d 
70,"Quy định về hệ số đầm chặt đất nền đường phụ thuộc vào các yếu tố nào?
a. Phụ thuộc vào nền đường đào, đắp
b. Phụ thuộc vào cấp hạng kỹ thuật của đường
c. Phụ thuộc vào chiều sâu từ đáy áo đường xuống
d. Phụ thuộc vào cả 3 yếu tố trên",d 
71,"Trong tiêu chuẩn thiết kế đường TCVN 4054 - 2005, lưu lượng thiết kế là lưu
lượng xe con được quy đổi từ các loại xe khác, thông qua mặt cắt trong ngày
đêm, tính cho năm tương lai. Với đường cấp I, II, năm tương lai quy định là
năm nào trong các phương án sau?
a. Năm thứ 10
b. Năm thứ 15
c. Năm thứ 20
d. Năm thứ 25",c 
72,"Trong tiêu chuẩn thiết kế đường TCVN 4054 - 2005, lưu lượng thiết kế là lưu
lượng xe con được quy đổi từ các loại xe khác, thông qua mặt cắt trong ngày
đêm, tính cho năm tương lai. Với đường cấp III, IV, năm tương lai quy định là
năm nào trong các phương án sau?
a. Năm thứ 10
b. Năm thứ 15
c. Năm thứ 20
d. Năm thứ 25",b 
73,"Trong tiêu chuẩn thiết kế đường TCVN 4054 - 2005, lưu lượng thiết kế là lưu
lượng xe con được quy đổi từ các loại xe khác, thông qua mặt cắt trong ngày
đêm, tính cho năm tương lai. Với đường cấp V, VI và đường nâng cấp, năm
tương lai quy định là năm nào trong các phương án sau?
a. Năm thứ 10
b. Năm thứ 15
c. Năm thứ 20
d. Năm thứ 25",a 
74,"Độ dốc ngang của mặt đường trên các đoạn thẳng được quy định để đảm bảo
thoát nước mưa, phụ thuộc vào loại mặt đường. Với mặt đường bê tông xi
măng và bê tông nhựa chọn độ dốc ngang bao nhiêu là đúng?
a. Độ dốc ngang 1,5 - 2,0 %
b. Độ dốc ngang 1,5 - 3,0 %
c. Độ dốc ngang 2,0 - 3,0 %
d. Độ dốc ngang 3,0 - 4,0 %",a 
75,"Trong tiêu chuẩn thiết kế đường TCVN 4054 - 2005 quy định: H là chiều cao
tĩnh không, tính từ điểm cao nhất của phần xe chạy (chưa xét đến chiều cao dự
trữ nâng cao mặt đường khi sửa chữa, cải tạo, nâng cấp); h chiều cao tĩnh
không ở mép ngoài lề đường. Khi thiết kế đường cấp I, II,III chọn các giá trị
nào trong các phương án sau:
a. H = 5,0, h = 4,5 m
b. H = 4,75, h = 4,0 m
c. H = 4,5 , h = 4,0 m
d. H = 4,25, h = 4,0 m",b 
76,"Trong tiêu chuẩn thiết kế đường TCVN 4054 - 2005 quy định: H là chiều cao
tĩnh không, tính từ điểm cao nhất của phần xe chạy (chưa xét đến chiều cao dự
trữ nâng cao mặt đường khi sửa chữa, cải tạo, nâng cấp); h chiều cao tĩnh
không ở mép ngoài lề đường. Khi thiết kế đường cấp IV và thấp hơn chọn các
giá trị nào trong các phương án sau:
a. H = 5,0, h = 4,5 m
b. H = 4,75, h = 4,0 m
c. H = 4,5 , h = 4,0 m
d. H = 4,25, h = 4,0 m",c 
77,"Trong tiêu chuẩn thiết kế mặt đường, phân ra mấy loại tầng mặt đường (cấp
mặt đường)?
a. Chỉ có 1 loại tầng mặt đường
b. Có 2 loại tầng mặt đường
c. Có 3 loại tầng mặt đường
d. Có 4 loại tầng mặt đường",d 
78,"Tải trọng tính toán mặt đường mềm, đối với đường ngoài đô thị được quy định
tải trọng trục xe. Tải trọng quy định là bao nhiêu?
a. Tải trọng trục 12 KN
b. Tải trọng trục 14 KN
c. Tải trọng trục 10KN
d. Tải trọng trục 8 KN",c 
79,"Tải trọng tính toán mặt đường cứng, đối với đường ngoài đô thị được quy định
tải trọng trục xe. Tải trọng quy định là bao nhiêu?
a. Tải trọng trục 12 KN
b. Tải trọng trục 14 KN
c. Tải trọng trục 10KN
d. Tải trọng trục 8 KN",c 
80,"Khi khảo sát lập thiết kế kỹ thuật tuyến đường, quy định phải đo dài tổng quát
để đóng các cọc H, cọc Km, quy định sai số cho phép hai lần đo fl = 1/ a. L,. fl
sai số tính bằng mét, L chiều dài đo tính bằng mét, a giá trị cho dưới đây.
Trong các phương án đưa ra chọn phương án đúng.
a. fl = 1/ 100. L
b. fl = 1/ 500. L
c. fl = 1/ 1000. L
d. fl = 1/ 1500. L",c 
81,"Khi khảo sát lập thiết kế kỹ thuật tuyến đường, quy định phải đo dài chi tiết để
đóng các cọc, chỉ cần đo một lần khớp vào H, cọc Km, quy định sai số cho
phép fl = 1/ a. L,. fl sai số tính bằng mét, L chiều dài đo tính bằng mét, a giá trị
cho dưới đây. Trong các phương án đưa ra chọn phương án đúng.
a. fl = 1/100. L
b. fl = 1/ 500. L
c. fl = 1/ 1000. L
d. fl = 1/ 1500. L",b 
