stt,question,answer
1,"Tốc độ cho phép lưu hành trên đường là phương án nào trong phương án sau ?
a. Là tốc độ thiết kế của đường
b. Là tốc độ quy định theo cấp hạng kỹ thuật của đường
c. Là tốc độ khai thác cho phép phụ thuộc vào tình trạng thực tế của đường do
cơ quan quản lý đường quy định
d. Là tốc độ dùng để tính toán các chỉ tiêu kỹ thuật chủ yếu của đường",c 
2,"Khi thiết kế trắc dọc đường ô tô cao tốc TCVN 5729: 2012 quy định chiều dài
tối thiểu tùy thuộc vào cấp đường và phải đủ để bố trí chiều dài đường cong
đứng. Với đường cấp 100 (Vtk = 100 km/h) chiều dài tối thiểu là bao nhiêu ?
a. Chiều dài tối thiểu 350 mét
b. Chiều dài tối thiểu 300 mét
c. Chiều dài tối thiểu 250 mét
d. Chiều dài tối thiểu 200 mét",c 
3,"Khi thiết kế trắc dọc đường ô tô cao tốc TCVN 5729: 2012 quy định chiều dài
tối đa đoạn dốc tùy thuộc vào cấp đường và độ dốc dọc. Với đường cấp 100
(Vtk = 100 km/h) và độ dốc dọc 4% chiều dài tối đa là bao nhiêu ?
a. Chiều dài tối đa 700 mét
b. Chiều dài tối đa 800 mét
c. Chiều dài tối đa 900 mét
d. Chiều dài tối đa 1000 mét",b 
4,"Khi xác định lưu lượng xe tính toán để xác định Eyc mặt đường phải xét đến
hệ số ảnh hưởng của số làn xe. Trong trường hợp đường có 2 hoặc 3 làn xe
không có dải phân cách thì hệ số phân phối trục xe f chọn là bao nhiêu? Trong
các trường hợp sau
a. Hệ số f = 1
b. Hệ số f = 0,5
c. Hệ số f= 0,55
d. Hệ số f = 0,35",c 
5,"Khi thiết kế một tuyến đường ô tô, tiêu chuẩn quy định chiều dài tối thiểu
thống nhất theo một cấp để đảm bảo an toàn. Đường từ cấp II trở lên chiều dài
tối thiểu quy định là bao nhiêu trong các phương án sau?
a. Không quy định
b. Chiều dài tối thiểu 5 km.
c. Chiều dài tối thiểu 7.5 km.
d. Chiều dài tối thiểu 10 km.",d 
6,"Độ bằng phẳng mặt đường được đánh giá qua chỉ số độ gồ ghề quốc tế IRI
(m/km). Với đường vận tốc thiết kế Vtk = 80 -120 km/h, làm mới thì tiêu chí
bằng phẳng của mặt đường BTN, BTXM trong vòng 1 năm từ khi làm xong
mặt đường theo IRI yêu cầu phải là phương án nào trong số phương án sau?
a.Chỉ số IRI yêu cầu ≤ 2,0
b.Chỉ số IRI yêu cầu ≤ 2,2
c.Chỉ số IRI yêu cầu ≤ 2,5
d.Chỉ số IRI yêu cầu < 2,5",a 
7,"Độ bằng phẳng mặt đường được đánh giá qua chỉ số độ gồ ghề quốc tế IRI
(m/km). Với đường vận tốc thiết kế Vtk = 80 -120 km/h, cải tạo, nâng cấp,
tăng cường thì IRI yêu cầu phải là phương án nào trong số phương án sau?
a.Chỉ số IRI yêu cầu < 2,0
b.Chỉ số IRI yêu cầu < 2,5
c.Chỉ số IRI yêu cầu < 2,8
d.Chỉ số IRI yêu cầu < 3,0",b 
8,"Biển báo hiệu đường bộ theo QCVN41-2019 được phân thành mấy nhóm? Các
phương án sau phương án nào đúng?
a.Có 2 nhóm biển báo hiệu đường bộ.
b.Có 3 nhóm biển báo hiệu đường bộ.
c.Có 4 nhóm biển báo hiệu đường bộ.
d.Có 5 nhóm biển báo hiệu đường bộ",d 
9,"Mức phục vụ (LOS) là thước đo về chất lượng vận hành của dòng giao thông
được chia làm bao nhiêu mức? Các phương án sau phương án nào đúng?
a.Có 4 mức
b.Có 5 mức
c.Có 6 mức
d.Có 7 mức",c 
10,"Định nghĩa đường giao thông nông thôn theo tiêu chuẩn TCVN10380:2014
bao gồm mấy loại?
a.Có 2 loại
b.Có 3 loại
c.Có 4 loại
d.Có 5 loại",d 
11,"Bán kính ống bọc cáp DƯL tại vị trí thông thường và vùng neo tối thiểu là bao
nhiêu?
a. 9000mm vị trí thông thường và 3600mm tại vị trí vùng neo
b. 5000mm vị trí thông thường và 3600mm tại vị trí vùng neo
c. 6000mm vị trí thông thường và 3600mm tại vị trí vùng neo
d. 9000mm vị trí thông thường và 6000mm tại vị trí vùng neo",c 
12,"Trên đường bộ cao tốc có dải phân cách rộng bao nhiêu trở lên không cần có
biện pháp chống chói?
a. 3m
b. 5m
c. 7m
d.12m",d 
13,"Khi treo biển trên giá long môn, cột cần vươn thì cạnh dưới của biển (hoặc
mép dưới của dầm nếu thấp hơn cạnh dưới biển) cách mặt đường ít nhất là bao
nhiêu đối với đường cao tốc ?
a. 5 m
b. 5,2 m
c. 5,5m
d. 5,7m",b 
14,"Theo cỡ hạt lớn nhất danh định, Bê tông nhựa chặt được phân thành mấy loại?
a. 4 loại
b. 5 loại
c. 6 loại
d. 7 loại",c 
15,"Đối với đường cao tốc có tốc độ thiết kế V≥80km/h, biển báo lắp đặt trên giá
long môn, cột cần vươn sử dụng loại màng phản quang nào là phù hợp?
a. Loại VIII
b. Loại IX
c. Loại X
d. Loại XI",d 
16,"Hệ số kích thước biển báo của Biển báo cấm, biển hiệu lệnh, biển báo nguy
hiểm và cảnh báo trên đường cao tốc là bao nhiêu?
a. 1,8
b. 2
c. 2,5
d. 3,0",b 
17,"Khoảng cách (S) giữa hai cọc tiêu trên đường thẳng thông thường là bao nhiêu
đối với đường cao tốc?
a. 10m
b. 20m
c. 30m
d. 40m",c 
18,"Khi thiết kế đường ô tô cao tốc theo TCVN 5729:2012, không xét đến việc làm
làn phụ leo dốc trong trường hợp nào?
a. Đường cao tốc có 4 làn xe trở lên (mỗi chiều hai làn xe) và các đoạn qua cầu
lớn, cầu cao, hầm, nền đường đào sâu.
b. Đường cao tốc có 6 làn xe trở lên (mỗi chiều ba làn xe trở lên) và các đoạn
đường cao tốc bốn làn nhưng qua cầu lớn, cầu cao, hầm, nền đào sâu.
c. Đường cao tốc có 6 làn xe trở lên và các đoạn có độ dốc dọc <3%.
d. Đường cao tốc thiết kế độ dốc dọc từ 3% trở lên với chiều dài dốc từ 800m
trở lên của đường cao tốc cấp 100 và 120.",b 
19,"Khi thiết kế đường ô tô cao tốc theo TCVN 5729:2012, trường hợp dốc ngang
mặt đường dưới 1% thì phải thiết kế độ dốc dọc tối thiểu là bao nhiêu %?
a. 0.5%
b. 0.3%
c. 1.0%
d. Không có quy định về độ dốc dọc đối với trường hợp này",a 
20,"Khi thiết kế đường ô tô cao tốc theo TCVN 5729:2012, quy định chiều dài tối
thiểu của đường cong đứng đối với đường cao tốc cấp 100 (Vtk=100km/h) là
bao nhiêu?
a. 55m
b. 65m
c. 75m
d. 85m",d 
21,"Khi thiết kế đường ô tô cao tốc theo TCVN 5729:2012, khi thiết kế dốc dọc
của đường cao tốc cấp 100 (Vtk=100km/h) tại các vị trí nút giao khác mức có
liên thông, quy định độ dốc dọc lớn nhất (giới hạn) là bao nhiêu %?
a. 2%
b. 2,5%
c. 3%
d. 4%",c 
22,"Khi thiết kế đường ô tô cao tốc theo TCVN 5729:2012, quy định chiều dài tối
thiểu của đoạn chuyển làn hình nêm đối với đường cao tốc cấp 120
(Vtk=120km/h) là bao nhiêu?
a. 55m
b. 65m
c. 75m
d. 85m",c 
23,"Khi thiết kế đường ô tô cao tốc theo TCVN 5729:2012, quy định tầm nhìn
dừng xe của đường nhánh trong nút giao khác mức liên thông có tốc độ xe
chạy tính toán trên đường nhánh V=50km/h là bao nhiêu?
a. 55m
b. 65m
c. 75m
d. 85m",b 
24,"Khi thiết kế áo đường mềm qua nền đào đá, chiều dày lớp tạo phẳng cần bố trí
theo hướng dẫn tại TCCS37:2022 là bao nhiêu?
a. Từ 10-15cm.
b. Từ 15-25cm.
c. Từ 20-30cm.
d. Từ 25-30cm.",c 
25,"Theo TCVN 13567-1:2022, Bột khoáng dùng cho bê tông nhựa chặt sử dụng
nhựa đường thông thường là sản phẩm được nghiền từ đá các-bô-nát (đá vôi
can – xít, đô-lô-mít), có cường độ nén của đá gốc tối thiểu là bao nhiêu?
a. 30 Mpa
b. 35 Mpa
c. 40 Mpa
d. 45 Mpa",c 
26,"Tốc độ thiết kế đường bộ cao tốc theo QCVN115:2024/BGTVT quy định các
cấp thiết kế như nào?
a. 60, 80, 100, 120.
b. 80, 100, 120.
c. 80, 90, 100, 120.
d. 60, 70, 80, 100, 120.",a 
27,"Theo QCVN 07-4:2023/BXD có những cấp đường nào
a. Cấp cao tốc, cấp trục chính đô thị, cấp phân khu.
b. Cấp cao tốc, cấp phố chính đô thị, cấp phân khu
c. Cấp đô thị, cấp khu vực, cấp nội bộ.
d. Cấp liên khu vực, cấp phố chính đô thị, cấp phân khu.",c 
28,"Đoạn thẳng nối hai đường cong cùng chiều và hai đường cong ngược chiều
được quy định như nào trong TCVN 5729:2012?
a. Đoạn thẳng bằng 4 lần vận tốc thiết kế (km/h).
b. Đoạn thẳng bằng 2 lần vận tốc thiết kế (km/h).
c. Đoạn thẳng bằng 6 lần vận tốc thiết kế (km/h) với đường cong cùng chiều, 2
lần vận tốc thiết kế (km/h) với đường cong ngược chiều
d. Đoạn thẳng bằng 6 lần vận tốc thiết kế (km/h).",b 
29,"Để đảm bảo cường độ và độ ổn định của nền đường cần quan tâm đến vùng
hoạt động 80 cm từ đáy áo đường: 30 cm trên phải đảm bảo CBR bằng 8 với
đường cấp I, II và bằng 6 với các cấp khác. 50 cm tiếp với CBR bằng 5 với
đường cấp I, II và bằng 4 với các cấp khác. Trị số CBR được xác định trong
trường hợp nào ?
a. CBR xác định trong trường hợp lấy mẫu tự nhiên
b. CBR xác định ngoài hiện trường
c. CBR xác định trong phòng, mẫu đất được đầm nén tiêu chuẩn, để khô.
d. CBR xác định trong phòng, mẫu đất được đầm nén tiêu chuẩn và ngâm mẫu
4 ngày đêm.",d 
30,"Trong thiết kế mặt đường bê tông xi măng theo Quyết định 32-30 của Bộ giao
thông vận tải thì cần kiểm tra cường độ kéo uốn của tấm bê tông xi măng khi
tải trọng bánh xe đặt ở đâu ?
a. Tải trọng xe đặt giữa tấm
b. Tải trọng xe đặt ở góc tấm
c. Tải trọng xe đặt ở giữa cạnh dài của tấm
d. Phải kiểm tra cả 3 vị trí trên",c 
31,"Kiểm toán kết cấu áo đường mềm đối với mặt đường cấp cao A1 phải kiểm
toán theo các thái giới hạn nào ?
a. Kiểm toán cường độ chung kết cấu.
b. Kiểm toán cắt trượt nền đất
c. Kiểm toán ứng suất kéo uốn của lớp mặt bê tông nhựa
d. Kiểm toán tất cả trạng thái giới hạn nêu trên",d 
32,"Khi thiết kế mặt đường bê tông nhựa, phải kiểm tra cường độ kéo uốn lớp bê
tông nhựa, vị trí kiểm tra là đâu trong các phương án sau ?
a. Kiểm tra tại mặt trên lớp bê tông nhựa
b. Kiểm tra tại vị trí giữa lớp bê tông nhựa
c. Kiểm tra tại vị trí 2/3 từ mặt bê tông nhựa
d. Kiểm tra tại vị trí đáy lớp bê tông nhựa",d 
33,"Nhằm đảm bảo sự chuyển tiếp êm thuận, không gây ra” xóc” mạnh cho xe
chạy qua đoạn chuyển tiếp thì độ bằng phẳng theo dọc tim đường S (S là độ
dốc dọc giữa hai điểm trên mặt đường theo phương dọc theo tim đường do sự
chênh lệch lún của hai điểm đó) giữa đường và cầu đối với đường cao tốc có
vận tốc thiết kế 100 và 120 km/h là bao nhiêu trong các giá trị sau ?
a. Độ bằng phẳng S ≤ 1/150
b. Độ bằng phẳng S ≤ 1/175
c. Độ bằng phẳng S ≤ 1/200
d. Độ bằng phẳng S ≤ 1/250",d 
34,"Nhằm đảm bảo sự chuyển tiếp êm thuận, không gây ra ""xóc” mạnh cho xe
chạy qua đoạn chuyển tiếp thì độ bằng phẳng theo dọc tim đường S (S là độ
dốc dọc giữa hai điểm trên mặt đường theo phương dọc theo tim đường do sự
chênh lệch lún của hai điểm đó) giữa đường và cầu đối với đường cấp I- IV có
vận tốc thiết kế 80 km/h là bao nhiêu trong các giá trị sau ?
a. Độ bằng phẳng S ≤ 1/125
b. Độ bằng phẳng S ≤ 1/150
c. Độ bằng phẳng S ≤ 1/ 175
d. Độ bằng phẳng S ≤ 1/200",c 
35,"Khi xác định lưu lượng xe tính toán để xác định Eyc mặt đường phải xét đến
hệ số ảnh hưởng của số làn xe. Trong trường hợp đường có 4 làn xe có dải
phân cách giữa thì hệ số phân phối trục xe f chọn là bao nhiêu ?
a. Hệ số f = 1
b. Hệ số f= 0,55
c. Hệ số f = 0,35
d. Hệ số f = 0,3",c 
36,"Khi xác định lưu lượng xe tính toán để xác định Eyc mặt đường phải xét đến
hệ số ảnh hưởng của số làn xe. Trong trường hợp đường có 2 hoặc3 làn xe
không có dải phân cách thì hệ số phân phối trục xe f chọn là bao nhiêu ?
a. Hệ số f = 1
b.Hệ số f= 0,55
c. Hệ số f = 0,35
d. Hệ số f = 0,3",b 
37,"Tốc độ cho phép lưu hành trên đường là phương án nào trong phương án sau ?
a. Là tốc độ thiết kế của đường
b. Là tốc độ quy định theo cấp hạng kỹ thuật của đường
c. Là tốc độ tối thiểu xe chạy trên đường
d. Là tốc độ lưu hành cho phép phụ thuộc vào tình trạng thực tế của đường do
cơ quan quản lý đường quy định",d 
38,"Khi thiết kế trắc dọc đường ô tô cao tốc TCVN 5729: 2012 quy định chiều dài
tối thiểu tùy thuộc vào cấp đường và phải đủ để bố trí chiều dài đường cong
đứng. Với đường cấp 100 (Vtk = 100 km/h) chiều dài tối thiểu là bao nhiêu ?
a. Chiều dài tối thiểu 300 mét
b. Chiều dài tối thiểu 250 mét
c. Chiều dài tối thiểu 200 mét
d. Chiều dài tối thiểu 150 mét",b 
39,"Khi thiết kế trắc dọc đường ô tô cao tốc TCVN 5729: 2012 quy định chiều dài
tối đa đoan dốc tùy thuộc vào cấp đường và độ dốc dọc. Với đường cấp 100
(Vtk = 100 km/h) và độ dốc dọc 4% chiều dài tối đa là bao nhiêu ?
a. Chiều dài tối đa 700 mét
b. Chiều dài tối đa 800 mét
c. Chiều dài tối đa 900 mét
d. Chiều dài tối đa 100 mét",b 
40,"Độ bằng phẳng của mặt đường có thể dùng thước 3 mét để kiểm tra. Đối với
mặt đường cấp cao A1 (bê tông nhựa, bê tông xi măng) thì quy định nào đúng
trong các phương án sau:
a. 70% số khe hở dưới 3mm và 30% số khe hở phải dưới 5 mm.
b. 20% số khe hở dưới 3mm và 80% số khe hở phải dưới 5 mm.
c. 30% số khe hở dưới 3mm và 70% số khe hở phải dưới 5 mm
d. 40% số khe hở dưới 3mm và 60% số khe hở phải dưới 5 mm",a 
41,"Trong tiêu chuẩn thiết kế đường quy định cao độ thiết kế nền đường. Quy định
nào trong 4 trường hợp sau đây là đúng và đủ?
a. Cao độ thiết kế của nền đường là cao độ ở tim đường.
b. Cao độ thiết kế của nền đường là cao độ ở tim đường. Khi có hai nền đường
độc lập sẽ có hai cao độ thiết kế trên hai mặt cắt dọc riêng biệt.
c. Cao độ thiết kế của nền đường là cao độ vai đường
d. Cao độ thiết kế của nền đường là cao độ mép mặt đường",b 
42,"Khi thiết kế rãnh biên qua khu dân cư chọn phương án nào là hợp lý?
a.Rãnh đất hoặc rãnh xây hình thang.
b. Rãnh đất hoặc rãnh xây hình tam giác.
c. Rãnh bê tông nửa tròn.
d. Rãnh xây hoặc bê tông xi măng có lát các tấm đan che kín, có hệ thống thu
nước mưa.",d 
43,"Độ bằng phẳng của mặt đường có thể dùng thước 3 mét để kiểm tra. Đối với
mặt đường cấp cao A2 (bê tông nhựa nguội, trên có láng mặt, thấm nhập nhựa,
láng nhựa) thì quy định nào đúng trong các phương án sau:
a. Tất cả phải dưới 5 mm.
b. 20% số khe hở dưới 3mm và 80% số khe hở phải dưới 5 mm.
c.30% số khe hở dưới 3mm và 70% số khe hở phải dưới 5 mm
d. 40% số khe hở dưới 3mm và 60% số khe hở phải dưới 5 mm",a 
44,"Cường độ kết cấu áo đường mềm được đặc trưng bởi giá trị nào trong các
phương án sau?
a. Mô đun đàn hồi của các lớp mặt đường.
b. Mô đun đàn hồi của các lớp móng đường.
c. Mô đun đàn hồi của lớp nền đất dưới kết cấu áo đường.
d. Mô đun đàn hồi chung của các lớp trong kết cấu áo đường + nền đất",d 
45,"Khi thiết kế đường cao tốc ở vùng địa hình núi, đồi cao và vùng địa hình khó
khăn người ta quy định chọn vận tốc hợp lý để giảm kinh phí xây dựng. Trong
các phương án sau chọn phương án nào là hợp lý.
a. Tốc độ thiết kế 100- 120 km/h
b. Tốc độ thiết kế 80- 100 km/h
c. Tốc độ thiết kế 60- 80 km/h
d. Tốc độ thiết kế 50 - 60 km/h",c 
46,"Khi thiết kế đường cao tốc ở vùng đồng bằng. Trong các phương án sau chọn
phương án nào là đúng với quy định tiêu chuẩn.
a.. Tốc độ thiết kế 120- 130 km/h
b. Tốc độ thiết kế 100- 120 km/h
c. Tốc độ thiết kế 80- 100 km/h
d. Tốc độ thiết kế 60- 80 km/h",b 
47,"Khi thiết kế đường ô tô cao tốc để đảm bảo an toàn chay xe, người ta quy định
chiều dài tối đa các đoạn thẳng. Các phương án sau phương án nào đúng?
a. Chiều dài tối đa 10 km.
b. Chiều dài tối đa 6 km.
c. Chiều dài tối đa 4 km
d. Chiều dài tối đa 2 km",c 
48,"Về mặt cấu tạo nút giao thông cùng mức ngoài đô thị, theo TCVN405 - 2005
chia làm mấy loại?
a. 1 loại
b. 2 loại
c. 3 loại
d. 4 loại",c 
49,"Trong các đường cong bằng bán kính nhỏ phải bố trí siêu cao, độ dốc siêu cao
phụ thuộc vào vận tốc thiết kế và bán kính đường cong. Tiêu chuẩn thiết kế
quy định độ dốc tối đa và độ dốc tối thiểu. Các phương án sau phương án nào
đúng với quy định?
a. Đội dốc siêu cao tối đa 10%, tối thiểu 2%
b. Đội dốc siêu cao tối đa 8%, tối thiểu 2%
c. Đội dốc siêu cao tối đa 6%, tối thiểu 2%
d. Đội dốc siêu cao tối đa 4%, tối thiểu 2%",b 
50,"Trên các tuyến đường có bố trí các tuyến xe buýt, để đảm bảo an toàn tiêu
chuẩn thiết kế quy định có thể sử dụng loại chỗ dừng đơn giản hoặc chỗ dừng
cách ly. Với các phương án sau, phương án nào đúng?
a. Trên đường Vtk ≥40 km/h, nhất thiết phải thiết kế chỗ dừng cách ly.
b.Trên đường Vtk ≥60 km/h, nhất thiết phải thiết kế chỗ dừng cách ly.
c. Trên đường Vtk ≥80 km/h, nhất thiết phải thiết kế chỗ dừng cách ly
d. Trên đường Vtk ≥100 km/h, nhất thiết phải thiết kế chỗ dừng cách ly",c 
51,"Khi thiết kế một tuyến đường ô tô, tiêu chuẩn quy định chiều dài tối thiểu
thống nhất theo một cấp để đảm bảo an toàn. Đường từ cấp III trở lên chiều dài
tối thiểu quy định là bao nhiêu trong các phương án sau?
a. Chiều dài tối thiểu 5 km.
b. Chiều dài tối thiểu 10 km.
c. Chiều dài tối thiểu 15 km.
d. Chiều dài tối thiểu 20 km",b 
52,"Biển báo hiệu đường bộ theo QCVN41-2016 được phân thành mấy nhóm?
Các phương án sau phương án nào đúng?
a. Có 3 nhóm biển báo hiệu đường bộ.
b. Có 4 nhóm biển báo hiệu đường bộ.
c. Có 5 nhóm biển báo hiệu đường bộ.",c 
53,"Khi thiết kế mặt đường cho đường phố và đường ít quan trọng ở đô thị thì dùng
tải trọng trục nào để tính toán trong các phương án sau?
a. Tải trọng trục 12.000 daN
b. Tải trọng trục 10.000 daN
c. Tải trọng trục 9.500 daN
d. Tải trọng trục 8.000 daN",c 
54,"Khi thiết kế mặt đường cho đường trục chính đô thị thì dùng tải trọng nào để
tính toán trong các phương án sau?
a. Tải trọng trục 12.000 daN
b. Tải trọng trục 10.000 daN
c. Tải trọng trục 9.500 daN
d. Tải trọng trục 8.000 daN",a 
55,"Độ bằng phẳng mặt đường được đánh giá qua chỉ số độ gồ ghề quốc tế IRI
(m/km). Với đường vận tốc thiết kế Vtk = 100 -120 km/h, làm mới thì IRI yêu
cầu phải là phương án nào trong số phương án sau?
a. Chỉ số IRI yêu cầu ≤ 2,0
b. Chỉ số IRI yêu cầu ≤ 2,2
c. Chỉ số IRI yêu cầu ≤ 2,5
d. Chỉ số IRI yêu cầu ≤ 4,0",a 
56,"Độ bằng phẳng mặt đường được đánh giá qua chỉ số độ gồ ghề quốc tế IRI
(m/km). Với đường vận tốc thiết kế Vtk = 100 -120 km/h, cải tạo, nâng cấp thì
IRI yêu cầu phải là phương án nào trong số phương án sau?
a. Chỉ số IRI yêu cầu ≤ 2,5
b. Chỉ số IRI yêu cầu ≤ 2,8
c. Chỉ số IRI yêu cầu ≤ 3,0
d. Chỉ số IRI yêu cầu ≤ 5,0",a 
57,"Độ bằng phẳng mặt đường được đánh giá qua chỉ số độ gồ ghề quốc tế IRI
(m/km). Với đường vận tốc thiết kế Vtk = 60 km/h, làm mới thì IRI yêu cầu
phải là phương án nào trong số phương án sau?
a.Chỉ số IRI yêu cầu ≤ 2,0
b. Chỉ số IRI yêu cầu ≤ 2,2
c. Chỉ số IRI yêu cầu ≤ 2,5
d. Chỉ số IRI yêu cầu ≤ 4,0",c 
58,"Độ bằng phẳng mặt đường được đánh giá qua chỉ số độ gồ ghề quốc tế IRI
(m/km). Với đường vận tốc thiết kế Vtk = 60 km/h, cải tạo, nâng cấp thì IRI
yêu cầu phải là phương án nào trong số phương án sau?
a. Chỉ số IRI yêu cầu ≤ 2,5
b. Chỉ số IRI yêu cầu ≤ 2,8
c. Chỉ số IRI yêu cầu ≤ 3,0
d. Chỉ số IRI yêu cầu ≤ 5,0",c 
59,"Độ bằng phẳng của mặt đường có thể dùng thước 3 mét để kiểm tra. Đối với
mặt đường cấp cao A2 (bê tông nhựa nguội, trên có láng mặt, thấm nhập nhựa,
láng nhựa) thì quy định nào đúng trong các phương án sau:
a. 20% số khe hở dưới 3mm và 80% số khe hở phải dưới 5 mm.
b.30% số khe hở dưới 3mm và 70% số khe hở phải dưới 5 mm
c. 40% số khe hở dưới 3mm và 60% số khe hở phải dưới 5 mm
d. Tất cả phải dưới 10 mm.",d 
60,"Khi đắp nền đường trên đất yếu phải sử dụng lớp đệm cát để thoát nước ngang.
Trong các trường hợp sau trường hợp nào phải dùng tầng đệm cát:
a. Trường hợp đắp trực tiếp trên đất yêu
b. Trường hợp đào một phần hay toàn bộ tầng đất yếu
c. Sử dụng giếng cát hay bấc thấm thoát nước thẳng đứng
d. Tất cả 3 trường hợp trên",d 
61,"Trong tiêu chuẩn thiết kế đường ô tô TCVN 4054 - 2005 ngoài đường ô tô cao
tốc, có các phương án phân loại dưới đây. Phương án nào đúng.
a. Đường có 6 cấp, từ cấp I tới cấp VI
b. Đường có 5 cấp, từ cấp I tới cấp V
c. Đường có 4 cấp, từ cấp I tới cấp IV
d. Đường có 3 cấp, từ cấp I tới cấp III",a 
62,"Theo tiêu chuẩn thiết kế đường giao thông nông thôn TCVN 10380: 2014
đường giao thông nông thôn có mấy cấp? chọn phương án đúng?
a. Có 1 cấp A
b. Có 2 cấp A, B
c. Có 3 cấp A, B, C
d. Có 4 cấp A, B, C, D",d 
63,"Tốc độ thiết kế của đường được hiểu thế nào?
a. Tốc độ lớn nhất cho phép xe chạy trên đường
b. Tốc độ khai thác của đường
c. Là tốc độ được dùng để tính toán các chỉ tiêu kỹ thuật chủ yếu của đường
trong trường hợp khó khăn
d. Tốc độ trung bình xe chạy trên đường",c 
64,"Chiều rộng một làn xe trong tiêu chuẩn thiết kế đường TCVN 4054 - 2005 có
mấy loại kích thước? Phương án nào đúng và đủ?
a. Có các chiều rộng 3,75 m, 3,5 mét, 3,0 m và 2,75 m.
b. Có các chiều rộng 3,75 m, 3,5 mét và 3,0 m.
c. Có các chiều rộng 3,75 m, 3,5 mét
d. Chỉ có chiều rông 3,5 m",a 
65,"Trong tiêu chuẩn thiết kế yếu tố hình học của đường quy định mấy loại bán
kính đường cong nằm tối thiểu? phương án nào đúng và đủ.
a. Bán kính đường cong nằm tối thiểu giới hạn
b. Bán kính đường đường cong tối thiểu giới hạn, tối thiểu thông thường
c. Bán kính đường cong tối thiểu giới hạn, tối thiểu không siêu cao
d. Bán kính tối thiểu giới hạn, tối thiểu thông thường và tối thiểu không siêu
cao",d 
